{
  "$schema": "http://json-schema.org/draft-07/schema#",
  "type": "object",
  "properties": {
    "color": { "type": "object" },
    "typography": { "type": "object" },
    "spacing": { "type": "object" },
    "layout": { "type": "object" }
  },
  "additionalProperties": true
}
