{
  "$schema": "../ops/schemas/design-tokens.schema.json",
  "color": {
    "brand": {
      "primary": { "value": "#E86F1F" },
      "secondary": { "value": "#111111" },
      "accent": { "value": "#F5F0EA" }
    },
    "feedback": {
      "success": { "value": "#22C55E" },
      "error": { "value": "#EF4444" }
    }
  },
  "typography": {
    "display": {
      "fontFamily": { "value": "Neue Haas Grotesk Display" },
      "fontSize": { "value": "48px" },
      "lineHeight": { "value": "1.1" },
      "fontWeight": { "value": 700 }
    },
    "body": {
      "fontFamily": { "value": "Inter" },
      "fontSize": { "value": "16px" },
      "lineHeight": { "value": "1.5" }
    }
  },
  "spacing": {
    "xs": { "value": "4px" },
    "sm": { "value": "8px" },
    "md": { "value": "16px" },
    "lg": { "value": "24px" },
    "xl": { "value": "32px" }
  },
  "layout": {
    "gridColumns": { "value": 12 },
    "baselineGrid": { "value": 8 }
  }
}
